[
  {
    "page": 7,
    "table_index": 0,
    "method": "lattice",
    "accuracy": 80.2722268976661,
    "data": [
      {
        "0": "",
        "1": "WASH",
        "2": "",
        "3": "BLEACH",
        "4": "CLEAN",
        "5": "",
        "6": "",
        "7": "WAX & PROTECT",
        "8": "",
        "9": "",
        "10": "PROTECT",
        "11": "",
        "12": "",
        "13": "PROTECT",
        "14": "MAINTAIN",
        "15": "",
        "16": "COVER"
      },
      {
        "0": "",
        "1": "",
        "2": "",
        "3": "",
        "4": "",
        "5": "",
        "6": "",
        "7": "",
        "8": "",
        "9": "",
        "10": "",
        "11": "",
        "12": "",
        "13": "",
        "14": "",
        "15": "",
        "16": ""
      },
      {
        "0": "",
        "1": "",
        "2": "",
        "3": "H",
        "4": "",
        "5": "",
        "6": "",
        "7": "",
        "8": "",
        "9": "",
        "10": "",
        "11": "",
        "12": "",
        "13": "",
        "14": "",
        "15": "",
        "16": ""
      },
      {
        "0": "",
        "1": "",
        "2": "",
        "3": "C\nA\nE\nL\nB",
        "4": "",
        "5": "",
        "6": "",
        "7": "",
        "8": "",
        "9": "",
        "10": "",
        "11": "",
        "12": "",
        "13": "",
        "14": "",
        "15": "",
        "16": ""
      },
      {
        "0": "",
        "1": "",
        "2": "",
        "3": "",
        "4": "",
        "5": "",
        "6": "",
        "7": "",
        "8": "",
        "9": "",
        "10": "",
        "11": "",
        "12": "",
        "13": "",
        "14": "",
        "15": "",
        "16": ""
      },
      {
        "0": "",
        "1": "",
        "2": "",
        "3": "",
        "4": "",
        "5": "",
        "6": "",
        "7": "",
        "8": "",
        "9": "",
        "10": "",
        "11": "",
        "12": "",
        "13": "",
        "14": "",
        "15": "",
        "16": ""
      },
      {
        "0": "",
        "1": "",
        "2": "",
        "3": "",
        "4": "",
        "5": "",
        "6": "",
        "7": "",
        "8": "",
        "9": "",
        "10": "",
        "11": "",
        "12": "",
        "13": "",
        "14": "",
        "15": "",
        "16": ""
      },
      {
        "0": "",
        "1": "",
        "2": "",
        "3": "",
        "4": "",
        "5": "",
        "6": "",
        "7": "",
        "8": "",
        "9": "",
        "10": "",
        "11": "",
        "12": "",
        "13": "",
        "14": "",
        "15": "",
        "16": ""
      },
      {
        "0": "",
        "1": "",
        "2": "",
        "3": "",
        "4": "",
        "5": "",
        "6": "",
        "7": "",
        "8": "",
        "9": "",
        "10": "",
        "11": "",
        "12": "",
        "13": "",
        "14": "",
        "15": "",
        "16": ""
      },
      {
        "0": "",
        "1": "",
        "2": "",
        "3": "",
        "4": "",
        "5": "",
        "6": "",
        "7": "",
        "8": "",
        "9": "",
        "10": "",
        "11": "",
        "12": "",
        "13": "",
        "14": "",
        "15": "",
        "16": ""
      },
      {
        "0": "PRODUCT",
        "1": "Gel Wash #54",
        "2": "",
        "3": "Any Chlorine \nBleach Brand",
        "4": "Extreme\nMulti-Surface\nCleaner",
        "5": "",
        "6": "",
        "7": "Quick Wax #59",
        "8": "",
        "9": "",
        "10": "Extreme\nVinyl & Rubber\nProtectant",
        "11": "",
        "12": "",
        "13": "Corrosion\nBlock",
        "14": "Wash N Wax \n#143",
        "15": "",
        "16": "Furniture\nCovers"
      },
      {
        "0": "USED\nFOR",
        "1": "Remove soiling",
        "2": "",
        "3": "As needed to \nremove soiling, \nstaining and kill \norganic growth",
        "4": "Remove soiling \nand staining",
        "5": "",
        "6": "",
        "7": "Protects material \nand offers UV \nprotection",
        "8": "",
        "9": "",
        "10": "Protects material \nand offers UV \nprotection",
        "11": "",
        "12": "",
        "13": "Blocks corrosive \nsalt air and \nrestores oxidized \nand dry metal \nand painted metal \nsurfaces",
        "14": "Remove soiling \nspots and UV \nprotection",
        "15": "",
        "16": "Extreme Protection  \nfor Rainy Season, \nPollen Season, \nor out of town \nfor the season.\nPut a barrier \nbetween your \ninvestment and \nenvironment."
      },
      {
        "0": "USED\nON",
        "1": "All\nProducts",
        "2": "",
        "3": "Aluminum Frames \nWicker Frames\nSome Fabrics",
        "4": "Aluminum Frames \nWicker Frames\nAll Fabrics",
        "5": "",
        "6": "",
        "7": "Aluminum Frames \nWicker Frames",
        "8": "",
        "9": "",
        "10": "Best for\nPoliSoul\u2122\nPoly Timber",
        "11": "",
        "12": "",
        "13": "All Metal and\nFinished Metal\nSurfaces",
        "14": "Aluminum Frames \nWicker Frames",
        "15": "",
        "16": "All\nProducts"
      }
    ],
    "csv": "0,1,2,3,4,5,6,7,8,9,10,11,12,13,14,15,16\n,WASH,,BLEACH,CLEAN,,,WAX & PROTECT,,,PROTECT,,,PROTECT,MAINTAIN,,COVER\n,,,,,,,,,,,,,,,,\n,,,H,,,,,,,,,,,,,\n,,,\"C\nA\nE\nL\nB\",,,,,,,,,,,,,\n,,,,,,,,,,,,,,,,\n,,,,,,,,,,,,,,,,\n,,,,,,,,,,,,,,,,\n,,,,,,,,,,,,,,,,\n,,,,,,,,,,,,,,,,\n,,,,,,,,,,,,,,,,\nPRODUCT,Gel Wash #54,,\"Any Chlorine \nBleach Brand\",\"Extreme\nMulti-Surface\nCleaner\",,,Quick Wax #59,,,\"Extreme\nVinyl & Rubber\nProtectant\",,,\"Corrosion\nBlock\",\"Wash N Wax \n#143\",,\"Furniture\nCovers\"\n\"USED\nFOR\",Remove soiling,,\"As needed to \nremove soiling, \nstaining and kill \norganic growth\",\"Remove soiling \nand staining\",,,\"Protects material \nand offers UV \nprotection\",,,\"Protects material \nand offers UV \nprotection\",,,\"Blocks corrosive \nsalt air and \nrestores oxidized \nand dry metal \nand painted metal \nsurfaces\",\"Remove soiling \nspots and UV \nprotection\",,\"Extreme Protection  \nfor Rainy Season, \nPollen Season, \nor out of town \nfor the season.\nPut a barrier \nbetween your \ninvestment and \nenvironment.\"\n\"USED\nON\",\"All\nProducts\",,\"Aluminum Frames \nWicker Frames\nSome Fabrics\",\"Aluminum Frames \nWicker Frames\nAll Fabrics\",,,\"Aluminum Frames \nWicker Frames\",,,\"Best for\nPoliSoul\u2122\nPoly Timber\",,,\"All Metal and\nFinished Metal\nSurfaces\",\"Aluminum Frames \nWicker Frames\",,\"All\nProducts\"\n",
    "shape": [
      13,
      17
    ]
  }
]